{
    "resourcefulbees:core/v1": {
        "flower": "#c:storage_blocks/gold",
        "honeycombVariation": "gold",
        "maxTimeInHive": 800
    },
    "resourcefulbees:rendering/v1": {
        "texture": "ores/gold/gold_bee",
        "model": "resourcefulbees:ore",
        "layers" : [
            { "isPollen": true, "color": "#FCEE4B", "texture": "custom_nectar" }
        ],
        "colors": {
            "spawnEgg": "#8F8F8F",
            "jarColor": "#FFDC00"
        }
    },
    "resourcefulbees:mutation/v1": {
        "mutation": "resourcefulbees:mutations/gold"
    },
    "resourcefulbees:breeding/v1": {
        "families": [
            {
                "parent1": "resourcefulbees:gold_bee",
                "parent2": "resourcefulbees:gold_bee"
            }
        ]
    },
    "resourcefulbees:trade/v1": {
        "amount": {
            "min": 1,
            "max": 1
        },
        "secondaryItem": "minecraft:gold_block",
        "secondaryItemCost": {
            "min": 4,
            "max": 8
        },
        "maxTrades": 2
    }
}