{
  "resourcefulbees:core/v1": {
    "flower": "minecraft:beacon",
    "honeycombVariation": "starry",
    "maxTimeInHive": 1200,
    "lore": [
      {
        "text":"Reach for the stars!"
      },
      {
        "translate":"tooltip.resourcefulbees.bee.creator",
        "with": ["§6Lady Lexxie"]
      }
    ]
  },
  "resourcefulbees:rendering/v1": {
    "texture": "starry/starry_bee",
    "colors": {
      "spawnEgg": "#FFA500",
      "jarColor": "#FFA500"
    },
    "layers": [
      {
        "layerEffect": "GLOW",
        "color": "#FFA500",
        "texture": "starry/starry_bee_emissive"
      }
    ],
    "sizeModifier": 1.25,
    "model": "resourcefulbees:queen"
  },
  "resourcefulbees:trait/v1": {
    "traits": [ "starry" ]
  },
  "resourcefulbees:combat/v1": {
    "isInvulnerable": true,
    "removeStingerOnAttack": false,
    "inflictsPoison": false,
    "attributes": {
      "attack_damage": 0,
      "max_health": 20
    }
  },
  "resourcefulbees:mutation/v1": {
    "count": 1,
    "mutation": "resourcefulbees:mutations/starry"
  }
}