{
    "resourcefulbees:core/v1": {
        "flower": ["minecraft:nether_wart"],
        "maxTimeInHive": 1000
    },
    "resourcefulbees:rendering/v1": {
        "texture": "pigman/pigman_bee",
        "colors": {
            "spawnEgg": "#885956",
            "jarColor": "#885956"
        }
    },
    "resourcefulbees:mutation/v1": {
        "mutation" : "resourcefulbees:mutations/pigman"
    },
    "resourcefulbees:breeding/v1": {
        "families": [
            {
                "parent1": "resourcefulbees:pigman_bee",
                "parent2": "resourcefulbees:pigman_bee"
            }
        ]
    },
    "resourcefulbees:trait/v1": {
        "traits": ["nether", "pigman"]
    },
    "resourcefulbees:trade/v1": {
        "amount": {
            "min": 1,
            "max": 1
        },
        "secondaryItem": "minecraft:glowstone",
        "secondaryItemCost": {
            "min": 12,
            "max": 16
        },
        "maxTrades": 2
    }
}