{
    "resourcefulbees:core/v1": {
        "flower": "#c:storage_blocks/netherite",
        "honeycombVariation": "netherite",
        "maxTimeInHive": 600
    },
    "resourcefulbees:rendering/v1": {
        "texture": "ores/netherite/netherite_bee",
        "colors": {
            "spawnEgg": "#654740",
            "jarColor": "#654740"
        }
    },
    "resourcefulbees:mutation/v1": {
        "mutation": "resourcefulbees:mutations/netherite"
    },
    "resourcefulbees:breeding/v1": {
        "families": [
            {
                "parent1": "resourcefulbees:wither_bee",
                "parent2": "resourcefulbees:diamond_bee"
            }
        ]
    },
    "resourcefulbees:trait/v1": {
        "traits": ["nether", "wither"]
    }
}