{
    "resourcefulbees:core/v1": {
        "flower": ["minecraft:obsidian"],
        "honeycombVariation": "dragon",
        "maxTimeInHive": 2400
    },
    "resourcefulbees:rendering/v1": {
        "texture": "dragon/ender_dragon_bee",
        "model": "resourcefulbees:dragon",
        "layers": [
            { "isPollen": true, "color": "#E400FF", "texture": "custom_nectar" },
            { "layerEffect": "GLOW", "texture": "dragon/dragon_bee_emissive", "color": "#E400FF" }
        ],
        "colors": {
            "spawnEgg": "#171717",
            "jarColor": "#222222"
        }
    },
    "resourcefulbees:mutation/v1": {
        "mutation": "resourcefulbees:mutations/dragon"
    },
    "resourcefulbees:breeding/v1": {
        "families": [
            {
                "parent1": "resourcefulbees:wither_bee",
                "parent2": "resourcefulbees:ender_bee",
                "chance": 0.25
            }
        ]
    },
    "resourcefulbees:trait/v1": {
        "traits": [ "ender", "nether", "wither" ]
    }
}