{
  "resourcefulbees:core/v1": {
    "flower": "#minecraft:flowers",
    "honeycombVariation": "oreo",
    "maxTimeInHive": 6000,
    "lore": [
      {
        "text":"A Delicious Bee.",
        "color": "aqua"
      },
      {
        "translate":"tooltip.resourcefulbees.bee.creator",
        "with": ["§6Epic_Oreo"]
      }
    ]
  },
  "resourcefulbees:rendering/v1": {
    "texture": "oreo/oreo_bee",
    "colors": {
      "spawnEgg": "#442920",
      "jarColor": "#442920"
    },
    "sizeModifier": 1.25
  },
  "resourcefulbees:trait/v1": {
    "traits": [ "oreo" ]
  },
  "resourcefulbees:combat/v1": {
    "removeStingerOnAttack": false,
    "inflictsPoison": false,
    "attributes": {
      "attack_damage": 1,
      "max_health": 2,
      "armor": 5,
      "armor_toughness": 10,
      "attack_knockback": 3
    }
  }
}